{
  "generation": 7,
  "state": {"schemaVersion":"simulator-workbench.state.v1","generatedAt":"2026-07-14T11:00:00Z","snapshotGeneration":7,"scenarioId":"scheduler-drift","valueBasisSummary":{"measured":1,"imputed":1,"simulated":1},"measuredStateRefs":["scada_measured_frames"],"twinStateRef":"digital_twin_state_values","lineageRefs":["digital_twin_lineage"],"activeSimulationRuns":[{"runId":"run-1","scenarioId":"scheduler-drift","lifecycle":"streaming","valueBasis":"simulated","health":"nominal","artifactStatus":"committed"}],"panels":[{"panelId":"measured","title":"Measured State","valueBasis":"measured"},{"panelId":"simulated","title":"Simulated Result State","valueBasis":"simulated"}]},
  "measured": [{"schemaVersion":"scada.telemetry.v1","sourceId":"source-1","reactorId":"reactor-01","tagId":"TAG-CORE","assetId":"ASSET-CORE-A","signalKind":"flux","sampledAt":"2026-07-14T10:59:59Z","observedAt":"2026-07-14T11:00:00Z","sequence":1,"unit":"relative","value":{"scalar":0.81},"quality":"good","valueBasis":"measured","syntheticStatus":"public-safe-standin"}],
  "twin": {"schemaVersion":"digital-twin.state.v1","twinId":"twin-live-1","asOf":"2026-07-14T11:00:00Z","entities":[{"entityId":"ASSET-CORE-A","displayName":"Core asset","values":[{"valueId":"VAL-MEASURED-TAG-CORE","label":"Measured core signal","valueBasis":"measured","unit":"relative","value":{"scalar":0.81},"confidence":1,"freshness":{"ageSec":1,"status":"fresh"},"lineageId":"lin-measured","sourceIds":["TAG-CORE"]},{"valueId":"VAL-IMPUTED-CORE-MARGIN","label":"Core margin","valueBasis":"imputed","unit":"percent","value":{"scalar":14},"confidence":0.7,"freshness":{"ageSec":4,"status":"fresh"},"lineageId":"lin-imputed","sourceIds":["TAG-CORE"]},{"valueId":"margin-simulated","label":"Forecast margin","valueBasis":"simulated","unit":"percent","value":{"scalar":16},"confidence":0.6,"freshness":{"ageSec":3,"status":"fresh"},"lineageId":"lin-simulated","sourceIds":["run-1"]}]}]},
  "lineage": [{"schemaVersion":"digital-twin.lineage.v1","lineageId":"lin-imputed","valueId":"VAL-IMPUTED-CORE-MARGIN","valueBasis":"imputed","inputs":[{"sourceKind":"scada-tag","sourceId":"TAG-CORE","valueBasis":"measured"},{"sourceKind":"simulation-run","sourceId":"run-1","valueBasis":"simulated"}],"processingSteps":["project"],"artifacts":[]},{"schemaVersion":"digital-twin.lineage.v1","lineageId":"lin-simulated","valueId":"margin-simulated","valueBasis":"simulated","inputs":[{"sourceKind":"simulation-run","sourceId":"run-1","valueBasis":"simulated"}],"processingSteps":["project"],"artifacts":[]}],
  "results": [{"schemaVersion":"simops.result.v1","runId":"run-1","scenarioId":"scheduler-drift","workerId":"worker-1","workerKind":"scheduler","sequence":1,"producedAt":"2026-07-14T11:00:00Z","resultType":"syntheticEngineeringState","modelId":"model-1","inputWindow":{"start":"2026-07-14T10:59:00Z","end":"2026-07-14T11:00:00Z"},"valueBasis":"simulated","syntheticStatus":"public-safe-standin","values":[{"resultId":"result-asset-only","entityId":"ASSET-CORE-A","valueId":"result-asset-only","label":"Asset-scoped simulated result","unit":"percent","value":{"scalar":18},"confidence":0.62}]}]
}
